label,label_encoded,cleaned_message,message_length,word_count,capital_count,special_char_count,has_free,has_win,has_winner,has_prize,has_call,has_txt,has_claim,has_urgent,has_guaranteed
spam,1,as a sim subscriber you are selected to receive a bonus get it delivered to your door txt the word ok to no to claim pmsg exp apr,148,29,14,1,0,0,0,0,0,1,1,0,0
ham,0,i need you to be in my strong arms,37,9,1,0,0,0,0,0,0,0,0,0,0
ham,0,also maaaan are you missing out,31,6,1,0,0,0,0,0,0,0,0,0,0
ham,0,his bday real is in april,27,7,1,0,0,0,0,0,0,0,0,0,0
ham,0,guessin you aint gonna be here before,41,8,1,1,0,0,0,0,0,0,0,0,0
ham,0,ok then i will come to ur home after half an hour,49,12,1,0,0,0,0,0,0,0,0,0,0
ham,0,yo the game almost over want to go to walmart soon,52,11,2,1,0,0,0,0,0,0,0,0,0
ham,0,yeah probably but not sure ilol let u know but personally i wuldnt bother then again if ur goin to then i mite as well,124,25,4,2,0,0,0,0,0,0,0,0,0
ham,0,ill text now all creepy like so he wont think that we forgot,63,13,2,1,0,0,0,0,0,0,0,0,0
ham,0,that would be good ill phone you tomo lunchtime shall i to organise something,85,15,2,1,0,0,0,0,0,0,0,0,0
spam,1,you have new voicemail please call,50,8,2,0,0,0,0,0,1,0,0,0,0
ham,0,damn can you make it tonight or do you want to just wait til tomorrow,70,15,1,0,0,0,0,0,0,0,0,0,0
ham,0,kkim also finewhen will you complete the course,55,8,1,1,0,0,0,0,0,0,0,0,0
ham,0,true it is passable and if you get a high score and apply for phd you get years of salary so it makes life easier,119,25,4,0,0,0,0,0,0,0,0,0,0
spam,1,no nokia tone ur mob every week just txt nok to st tone free so get txtin now and tell ur friends ptone reply hl info,143,31,14,2,1,0,0,0,0,1,0,0,0
ham,0,prakesh is there know,22,4,1,0,0,0,0,0,0,0,0,0,0
ham,0,teach me apps da when you come to college,43,9,2,0,0,0,0,0,0,0,0,0,0
ham,0,rofl betta invest in some anti aging products,46,8,1,0,0,0,0,0,0,0,0,0,0
ham,0,sir you will receive the account no another hr time sorry for the delay,75,14,1,0,0,0,0,0,0,0,0,0,0
spam,1,reply with your name and address and you will receive by post a weeks completely free accommodation at various global locations php,159,23,21,0,1,0,0,0,0,0,0,0,0
ham,0,so ll be submitting da project tmr rite,43,8,2,1,0,0,0,0,0,0,0,0,0
spam,1,free entry into our weekly comp just send the word enter to now tc cust care,123,21,15,0,1,0,0,0,0,0,0,0,0
ham,0,jus ans me lar ull noe later,31,7,2,0,0,0,0,0,0,0,0,0,0
ham,0,i want to send something that can sell fast ltgt k is not easy money,76,15,1,0,0,0,0,0,0,0,0,0,0
ham,0,have got few things to do may be in pub later,51,13,0,0,0,0,0,0,0,0,0,0,0
ham,0,s finish meeting call me,27,5,0,0,0,0,0,0,1,0,0,0,0
ham,0,lol ok ill snatch her purse too,34,7,2,0,0,0,0,0,0,0,0,0,0
ham,0,edrunk sorry iff pthis makes no senrddnot no how dancce drum n basqihave fun nhite x ros xxxxxxx,125,21,1,1,0,0,0,0,0,0,0,0,0
ham,0,how much are we getting,24,5,1,1,0,0,0,0,0,0,0,0,0
ham,0,is ur paper in e morn or aft tmr,33,9,1,1,0,0,0,0,0,0,0,0,0
ham,0,dear relieved of westonzoyland all going to plan this end too,63,11,1,1,0,0,0,0,0,0,0,0,0
ham,0,hope you are having a great new semester do wish you the very best you are made for greatness,96,19,3,0,0,0,0,0,0,0,0,0,0
ham,0,oh yes i can speak txt u no hmm did u get email,53,14,4,2,0,0,0,0,0,1,0,0,0
ham,0,i want to show you the world princess how about europe,59,12,1,1,0,0,0,0,0,0,0,0,0
ham,0,nobody can decide where to eat and dad wants chinese,52,10,2,0,0,0,0,0,0,0,0,0,0
ham,0,no shoot me im in the docs waiting room,45,10,2,0,0,0,0,0,0,0,0,0,0
ham,0,now im going out dinner soon,34,7,2,1,0,0,0,0,0,0,0,0,0
ham,0,hello which the site to download songs its urgent pls,53,10,1,0,0,0,0,0,0,0,0,1,0
ham,0,i do know what u mean is the king of not havin credit im goinbed now night night sweet onlymore sleep,111,21,4,3,0,0,0,0,0,0,0,0,0
ham,0,horrible gal me in sch doing some stuff how come u got mc,60,13,3,1,0,0,0,0,0,0,0,0,0
ham,0,hi hun im not comin nitetell every im sorry me hope u ava goodtimeoli rang melnite ifink it mite b sortedbut il explain everythin on monlrsx,152,27,114,2,0,0,0,0,0,0,0,0,0
spam,1,please call immediately as there is an urgent message waiting for you,81,13,5,0,0,0,0,0,1,0,0,1,0
ham,0,yeah like if it goes like it did with my friends imma flip my shit in like half an hour,87,20,1,0,0,0,0,0,0,0,0,0,0
ham,0,mum say we wan to go then go then she can shun bian watch da glass exhibition,84,17,2,0,0,0,0,0,0,0,0,0,0
ham,0,what your plan for pongal,26,5,1,1,0,0,0,0,0,0,0,0,0
ham,0,just wait till end of march when el nino gets himself oh,58,12,2,0,0,0,0,0,0,0,0,0,0
ham,0,not yet chikkugoing to room nw im in bus,46,9,1,0,0,0,0,0,0,0,0,0,0
ham,0,am also doing in cbe only but have to pay,43,10,2,0,0,0,0,0,0,0,0,0,0
ham,0,honey boo im missing u,24,5,2,0,0,0,0,0,0,0,0,0,0
ham,0,we have sent jd for customer service cum accounts executive to ur mail id for details contact us,97,18,8,0,0,0,0,0,0,0,0,0,0
ham,0,yo im at my parents gettin cash good news we picked up a downstem,70,14,3,0,0,0,0,0,0,0,0,0,0
ham,0,thank you so much when we skyped wit kz and sura we didnt get the pleasure of your company hope you are good weve given you ultimatum oh we are countin down to aburo enjoy,179,35,6,2,0,0,0,0,0,0,0,0,0
spam,1,hungry gay guys feeling hungry and up it now call just pmin to stop texts call pmin,120,20,3,0,0,0,0,0,1,0,0,0,0
ham,0,ok no wahala just remember that a friend in need,54,11,3,0,0,0,0,0,0,0,0,0,0
ham,0,i will see in half an hour,26,7,1,0,0,0,0,0,0,0,0,0,0
ham,0,im in inperialmusic listeningthe weirdest track ever byleafcutter johnsounds like insects being molestedsomeone plumbingremixed by evil men on acid,156,19,3,1,0,0,0,0,0,0,0,0,0
ham,0,hey sorry i didntgive ya a a bellearlier hunnyjust been in bedbut mite go thepub ltr if uwana mt uploads a luv jenxxx,123,24,3,1,0,0,0,0,0,0,0,0,0
ham,0,seriously tell her those exact words right now,48,8,39,0,0,0,0,0,0,0,0,0,0
spam,1,can u get phone now i wanna chat set up meet call me now on u can cum here moro luv jane xx callsminmoremobsemspoboxpowa,147,27,28,1,0,0,0,0,1,0,0,0,0
ham,0,tee hee off to lecture cheery bye bye,40,8,2,0,0,0,0,0,0,0,0,0,0
ham,0,sorry chikku my cell got some problem thts y i was nt able to reply u or msg u,81,19,1,0,0,0,0,0,0,0,0,0,0
ham,0,if you still havent collected the dough pls let me know so i can go to the place i sent it to get the control number,116,26,1,0,0,0,0,0,0,0,0,0,0
ham,0,ok,5,1,1,0,0,0,0,0,0,0,0,0,0
spam,1,network operator the service is free for t cs visit biz,66,12,4,0,1,0,0,0,0,0,0,0,0
ham,0,let me know how to contact you ive you settled in a room lets know you are ok,81,18,3,0,0,0,0,0,0,0,0,0,0
ham,0,wot u up u weirdo,20,6,1,1,0,0,0,0,0,0,0,0,0
ham,0,can do lor,13,3,1,0,0,0,0,0,0,0,0,0,0
ham,0,dont put your phone on silent mode ok,37,8,1,0,0,0,0,0,0,0,0,0,0
ham,0,can i meet at as where depends on where wan in lor,66,17,4,0,0,0,0,0,0,0,0,0,0
ham,0,waiting my tv show start lor u leh still busy doing ur report,69,15,2,1,0,0,0,0,0,0,0,0,0
ham,0,oh ho is this the first time u use these type of words,55,13,2,0,0,0,0,0,0,0,0,0,0
ham,0,am i the only one who doesnt stalk profiles,45,9,2,1,0,0,0,0,0,0,0,0,0
ham,0,ever green quote ever told by jerry in cartoon a person who irritates u always is the one who loves u vry much but fails to express it gud nyt,159,32,16,3,0,0,0,0,0,0,0,0,0
ham,0,yes i thought so thanks,25,5,2,0,0,0,0,0,0,0,0,0,0
ham,0,but if shes drinkin im ok,28,6,1,0,0,0,0,0,0,0,0,0,0
ham,0,just wondering the others just took off,40,7,1,0,0,0,0,0,0,0,0,0,0
ham,0,night has ended for another day morning has come in a special way may you smile like the sunny rays and leaves your worries at the blue blue bay gud mrng,156,31,3,0,0,0,0,0,0,0,0,0,0
ham,0,what do you do my dog must i always wait till the end of your day to have word from you did you run out of time on your cell already,138,33,4,3,0,0,0,0,0,0,0,0,0
ham,0,happy new year to u too,24,6,1,1,0,0,0,0,0,0,0,0,0
ham,0,heygreat dealfarm tour am to pm pax deposit by may,70,12,4,2,0,0,0,0,0,0,0,0,0
ham,0,eat jap done oso aft ur lect wat got lect at rite,62,14,2,0,0,0,0,0,0,0,0,0,0
ham,0,hey babe i saw you came online for a second and then you disappeared what happened,86,17,2,2,0,0,0,0,0,0,0,0,0
ham,0,da my birthdate in certificate is in april but real date is today but dont publish it i shall give you a special treat if you keep the secret any way thanks for the wishes,174,35,4,0,0,0,0,0,0,0,0,0,0
ham,0,happy birthday may all ur dreams come true,48,8,2,0,0,0,0,0,0,0,0,0,0
ham,0,aiyah u did ok already lar e nydc at wheellock,48,10,2,1,0,0,0,0,0,0,0,0,0
ham,0,tell her i said eat shit,25,6,19,0,0,0,0,0,0,0,0,0,0
ham,0,sure i am driving but will reach my destination soon,54,10,2,1,0,0,0,0,0,0,0,0,0
ham,0,k so am i how much for an th fifty,38,10,3,2,0,0,0,0,0,0,0,0,0
ham,0,your daily text from me a favour this time,46,10,1,0,0,0,0,0,0,0,0,0,0
ham,0,great to hear you are settling well so whats happenin wit ola,64,12,2,1,0,0,0,0,0,0,0,0,0
ham,0,those cocksuckers if it makes you feel better ipads are worthless garbage novelty items and you should feel bad for even wanting one,133,23,2,0,0,0,0,0,0,0,0,0,0
ham,0,i tot u reach liao he said tshirt,36,8,2,0,0,0,0,0,0,0,0,0,0
ham,0,fran i decided go n e way im completely broke an knackered i got up bout c u mrw love janx ps this is my dads fone no credit,132,31,96,0,0,0,0,0,0,0,0,0,0
ham,0,your right ill make the appointment right now,48,8,2,1,0,0,0,0,0,0,0,0,0
ham,0,designation is software developer and may be she get chennai,62,10,1,0,0,0,0,0,0,0,0,0,0
spam,1,enjoy the jamster videosound gold club with your credits for new videosounds logosmusicnews get more fun from jamstercouk only help call,163,23,2,3,0,0,0,0,1,0,0,0,0
spam,1,get lions england tone reply lionm mono or lionp poly more go the original n best tones gbp network operator rates apply,155,28,7,0,0,0,0,0,0,0,0,0,0
ham,0,i jokin oni lar busy then i wun disturb,48,11,3,0,0,0,0,0,0,0,0,0,0
ham,0,ok be careful dont text and drive,39,9,2,2,0,0,0,0,0,0,0,0,0
ham,0,ill always be there even if its just in spirit ill get a bb soon just trying to be sure i need it,103,23,3,0,0,0,0,0,0,0,0,0,0
ham,0,u r too much close to my heart if u go away i will be shattered plz stay with me,83,20,3,0,0,0,0,0,0,0,0,0,0
ham,0,i love u babe r u sure everything is alrite is he being an idiot txt bak girlie,84,19,4,2,0,0,0,0,0,1,0,0,0
ham,0,how abt making some of the pics bigger,39,8,1,1,0,0,0,0,0,0,0,0,0
ham,0,got but got colours lor one colour is quite light n e other is darker lor actually im done shes styling my hair now,122,25,3,0,0,0,0,0,0,0,0,0,0
ham,0,whenevr ur sad whenevr ur gray remembr im here listn watevr u wanna say jus walk wid me a little whileamp i promise ill bring back ur smile,154,30,6,0,0,0,0,0,0,0,0,0,0
ham,0,why nothing ok anyway give me treat,36,7,2,0,0,0,0,0,0,0,0,0,0
spam,1,win the newest harry potter and the order of the phoenix book reply harry answer questions chance to be the first among readers,140,26,11,1,0,1,0,0,0,0,0,0,0
ham,0,correct so how was work today,30,6,2,0,0,0,0,0,0,0,0,0,0
ham,0,just sent again do you scream and moan in bed princess,57,11,2,1,0,0,0,0,0,0,0,0,0
ham,0,i wake up long ago already dunno what other thing,54,10,2,1,0,0,0,0,0,0,0,0,0
ham,0,oh just getting even with u u,34,7,1,1,0,0,0,0,0,0,0,0,0
ham,0,i thk shd be ok he said plus minus did leave a line in between paragraphs,85,19,3,1,0,0,0,0,0,0,0,0,0
ham,0,can you call me plz your number shows out of coveragd area i have urgnt call in vasai amp have to reach before o clock so call me plz,139,29,3,0,0,0,0,0,1,0,0,0,0
ham,0,yeah jays sort of a fucking retard,35,7,1,0,0,0,0,0,0,0,0,0,0
ham,0,sorry was in the bathroom sup,31,6,1,0,0,0,0,0,0,0,0,0,0
spam,1,ur balance is now ur next question is who sang uptown girl in the s answer txt ur answer to good luck,126,26,13,2,0,0,0,0,0,1,0,0,0
ham,0,my exam is for february wish you a great day,48,11,2,0,0,0,0,0,0,0,0,0,0
ham,0,i dont know what to do to come out of this so only am ask questions like this dont mistake me,94,21,1,0,0,0,0,0,0,0,0,0,0
ham,0,aight no rush ill ask jay,27,6,2,0,0,0,0,0,0,0,0,0,0
ham,0,good morning plz call me sir,28,6,2,0,0,0,0,0,1,0,0,0,0
ham,0,its ok lar u sleep early too nite,41,8,3,0,0,0,0,0,0,0,0,0,0
ham,0,oh icic k lor den meet other day,42,8,3,0,0,0,0,0,0,0,0,0,0
ham,0,oh a half hour is much longer in syria than canada eh wow you must get so much more work done in a day than us with all that extra time grins,150,35,7,3,0,0,0,0,0,0,0,0,0
ham,0,sometimes we put walls around our heartsnot just to be safe from getting hurt but to find out who cares enough to break the walls amp get closer goodnoon,162,29,10,0,0,0,0,0,0,0,0,0,0
ham,0,sweet we may or may not go to u to meet carlos so gauge pattys interest in that,82,18,2,0,0,0,0,0,0,0,0,0,0
ham,0,then she buying today no need to c meh,45,10,2,1,0,0,0,0,0,0,0,0,0
ham,0,aight sorry i take ten years to shower whats the plan,56,11,3,1,0,0,0,0,0,0,0,0,0
ham,0,every mondaynxt week vl be completing,41,6,1,0,0,0,0,0,0,0,0,0,0
ham,0,might ax well im there,23,5,1,0,0,0,0,0,0,0,0,0,0
ham,0,just chill for another hrs if you could sleep the pain is not a surgical emergency so see how it unfolds okay,112,22,3,0,0,0,0,0,0,0,0,0,0
ham,0,yeah ill try to scrounge something up,38,7,2,0,0,0,0,0,0,0,0,0,0
ham,0,crazy ar hes married like gd looking guys not me my frens like say hes korean leonas fave but i dun thk he is aft some thinking mayb most prob ill go,160,33,4,0,0,0,0,0,0,0,0,0,0
ham,0,were somewhere on fredericksburg,32,4,2,0,0,0,0,0,0,0,0,0,0
ham,0,que pases un buen tiempo or something like that,47,9,1,0,0,0,0,0,0,0,0,0,0
ham,0,is it ok if i stay the night here xavier has a sleeping bag and im getting tired,82,18,4,1,0,0,0,0,0,0,0,0,0
ham,0,she doesnt need any test,25,5,1,0,0,0,0,0,0,0,0,0,0
ham,0,nothing much chillin at home any super bowl plan,51,9,2,1,0,0,0,0,0,0,0,0,0
spam,1,freeday sexy st georges day pic of jordantxt pic to dont miss out then every wk a saucy celeb more pics c pocketbabecouk wk,155,26,18,2,0,0,0,0,0,0,0,0,0
ham,0,bugis oso near wat,22,4,1,0,0,0,0,0,0,0,0,0,0
ham,0,yo theres no class tmrw right,30,6,1,1,0,0,0,0,0,0,0,0,0
ham,0,let ur heart be ur compass ur mind ur map ur soul ur guide and u will never loose in worldgnun sent via waysmscom,121,25,28,0,0,0,0,0,0,0,0,0,0
ham,0,goodnight sleep well da please take care pa please,53,9,2,0,0,0,0,0,0,0,0,0,0
ham,0,baaaaabe i misss youuuuu where are you i have to go and teach my class at,84,20,4,3,0,0,0,0,0,0,0,0,0
ham,0,u ned to convince him tht its not possible witot hurting his feeling its the main,81,16,1,0,0,0,0,0,0,0,0,0,0
ham,0,good afternoon loverboy how goes you day any luck come your way i think of you sweetie and send my love across the sea to make you smile and happy,152,32,4,3,0,0,0,0,0,0,0,0,0
ham,0,if i start sending blackberry torch to nigeria will you find buyer for melike a month and tell dad not to buy bb from anyone oh,131,26,2,1,0,0,0,0,0,0,0,0,0
ham,0,ltgt of pple marry with their lovers becz they hav gud undrstndng dat avoids problems i sent dis u u wil get gud news on friday by d person you like and tomorrow will be the best day of your life dont break this chain if you break you will suffer send this to ltgt frnds in ltgt mins whn u read,327,63,3,0,0,0,0,0,0,0,0,0,0
ham,0,yo dude guess who just got arrested the other day,49,10,1,0,0,0,0,0,0,0,0,0,0
ham,0,shuhui say change suntec steamboat u noe where where r u now,65,13,3,3,0,0,0,0,0,0,0,0,0
ham,0,what does the dance river do,29,6,1,1,0,0,0,0,0,0,0,0,0
ham,0,yetunde im sorry but moji and i seem too busy to be able to go shopping can you just please find some other way to get what you wanted us to get please forgive me you can reply free via yahoo messenger,207,42,4,0,1,0,0,0,0,0,0,0,0
ham,0,hey i will be really pretty late you want to go for the lesson first i will join you im only reaching tp mrt,114,24,4,1,0,0,0,0,0,0,0,0,0
spam,1,hot live fantasies call now just p per min ntt ltd po box croydon cr wb k,101,19,29,0,0,0,0,0,1,0,0,0,0
ham,0,bbq this sat at mine from ish ur welcome come,49,11,2,0,0,0,0,0,0,0,0,0,0
ham,0,i dont know same thing thats wrong everyso often he panicks starts goin on bout not bein good enough,108,20,1,0,0,0,0,0,0,0,0,0,0
ham,0,alright im outhave a good night,36,6,2,1,0,0,0,0,0,0,0,0,0
ham,0,did you try making another butt,32,6,1,0,0,0,0,0,0,0,0,0,0
ham,0,hope you are feeling great pls fill me in abiola,50,10,3,0,0,0,0,0,0,0,0,0,0
ham,0,i though we shd go out n have some fun so bar in town or something sound ok,80,19,1,1,0,0,0,0,0,0,0,0,0
ham,0,go to write msg put on dictionary mode cover the screen with hand press ltgt gently remove ur hand its interesting,141,24,8,0,0,0,0,0,0,0,0,0,0
spam,1,bears pic nick and tom pete and dick in fact all types try gay chat with photo upload call pmin stop texts call,151,27,7,0,0,0,0,0,1,0,0,0,0
spam,1,new mobiles from must go txt nokia to no collect yours todayfrom only optout gbpmtmsg txtauction,154,22,31,2,0,0,0,0,0,1,0,0,0
ham,0,were finally ready fyi,23,4,1,0,0,0,0,0,0,0,0,0,0
ham,0,auntie huai juan never pick up her phone,40,8,1,0,0,0,0,0,0,0,0,0,0
spam,1,double mins double txt price linerental on latest orange bluetooth mobiles call mobileupd for the very latest offers or calloptoutlf,159,24,13,0,0,0,0,0,1,1,0,0,0
ham,0,ya tel wats ur problem,25,5,1,0,0,0,0,0,0,0,0,0,0
ham,0,i dnt wnt to tlk wid u,22,7,0,0,0,0,0,0,0,0,0,0,0
ham,0,we spend our days waiting for the ideal path to appear in front of us but what we forget is paths are made by walking not by waiting goodnight,153,29,3,1,0,0,0,0,0,0,0,0,0
ham,0,its ok my arm is feeling weak cuz i got a shot so we can go another time,72,18,1,0,0,0,0,0,0,0,0,0,0
ham,0,please reserve ticket on saturday eve from chennai to thirunelvali and again from tirunelvali to chennai on sunday evei already see in netno ticket availablei want to book ticket through tackle,203,32,1,0,0,0,0,0,0,0,0,0,0
ham,0,storming msg wen u lift d phne u say hello do u knw wt is d real meaning of hello its d name of a girl yes and u knw who is dat girl margaret hello she is d girlfrnd f grahmbell who invnted telphone moralone can get d name of a person bt not his girlfrnd g o o d n i g h t,324,79,23,5,0,0,0,0,0,0,0,0,0
ham,0,thats ok i popped in to ask bout something and she said youd been in are you around tonght wen this girl comes,115,23,3,1,0,0,0,0,0,0,0,0,0
ham,0,all e best ur exam later,27,7,1,0,0,0,0,0,0,0,0,0,0
ham,0,hope ur head doesnt hurt much am ploughing my way through a pile of ironing staying in with a chinky tonight come round if you like,139,29,3,2,0,0,0,0,0,0,0,0,0
ham,0,oh ki think most of wi and nz players unsold,46,10,1,0,0,0,0,0,0,0,0,0,0
ham,0,haha where got so fast lose weight thk muz go a month den got effect geelater we go aust put bk e weight,115,24,3,0,0,0,0,0,0,0,0,0,0
ham,0,i wonder how you got online my love had you gone to the net cafe did you get your phone recharged were you on a friends net i think of you boytoy,155,36,5,4,0,0,0,0,0,0,0,0,0
ham,0,haha just kidding papa needs drugs,35,6,1,0,0,0,0,0,0,0,0,0,0
ham,0,thk shld b can ya i wana go lessons haha can go for one whole stretch,82,17,3,0,0,0,0,0,0,0,0,0,0
ham,0,oh ok,7,2,1,0,0,0,0,0,0,0,0,0,0
ham,0,r we still meeting dinner tonight,36,7,1,1,0,0,0,0,0,0,0,0,0
ham,0,thats cool i am a gentleman and will treat you with dignity and respect,73,14,2,1,0,0,0,0,0,0,0,0,0
ham,0,shall i start from hear,24,5,1,0,0,0,0,0,0,0,0,0,0
ham,0,then we wait u lor no need feel bad lar,49,12,2,0,0,0,0,0,0,0,0,0,0
ham,0,no did you check i got his detailed message now,48,10,2,1,0,0,0,0,0,0,0,0,0
ham,0,you have registered sinco as payee log in at icicibankcom and enter urn ltgt to confirm beware of frauds do not share or disclose urn to anyone,155,27,15,0,0,0,0,0,0,0,0,0,0
ham,0,no i decided that only people who care about stuff vote and caring about stuff is for losers,93,18,2,0,0,0,0,0,0,0,0,0,0
ham,0,kaiez enjoy ur tuition gee thk e second option sounds beta ill go yan jiu den msg u,99,18,5,0,0,0,0,0,0,0,0,0,0
ham,0,cool we will have fun practicing making babies,48,8,1,1,0,0,0,0,0,0,0,0,0
ham,0,actually getting ready to leave the house,42,7,1,0,0,0,0,0,0,0,0,0,0
ham,0,kkany special today,24,3,1,1,0,0,0,0,0,0,0,0,0
spam,1,urgent important information for o user today is your lucky day find out why log onto there is a fantastic surprise awaiting for you,163,26,128,1,0,0,0,0,0,0,0,1,0
ham,0,then we gotta do it after that,30,7,1,0,0,0,0,0,0,0,0,0,0
ham,0,ive got ten bucks jay is being noncomittal,44,8,1,0,0,0,0,0,0,0,0,0,0
ham,0,where at were hungry too,24,5,1,0,0,0,0,0,0,0,0,0,0
ham,0,pls speak to that customer machan,34,6,1,0,0,0,0,0,0,0,0,0,0
ham,0,somewhere out there beneath the pale moon light someone think in of u some where out there where dreams come true goodnite amp sweet dreams,144,25,0,0,0,0,0,0,0,0,0,0,0
spam,1,dear uve been invited to xchat this is our final attempt to contact u txt chat to pmsgrcvdhgsuitelandsrowwjhl ldn yrs,143,22,26,1,0,0,0,0,0,1,0,0,0
ham,0,so wats ur opinion abt him and how abt is character,52,11,1,1,0,0,0,0,0,0,0,0,0
ham,0,jay is snickering and tells me that x is totally fucking up the chords as we speak,82,17,1,0,0,0,0,0,0,0,0,0,0
ham,0,nofew hours beforewent to hair cut,39,7,1,0,0,0,0,0,0,0,0,0,0
ham,0,no wonder cos i dun rem seeing a silver car but i thk i saw a black one,80,18,3,0,0,0,0,0,0,0,0,0,0
ham,0,lmao take a pic and send it to me,35,9,2,0,0,0,0,0,0,0,0,0,0
ham,0,speak only when you feel your words are better than the silence gud mrng,78,14,2,0,0,0,0,0,0,0,0,0,0
ham,0,no shes currently in scotland for that,41,7,2,0,0,0,0,0,0,0,0,0,0
ham,0,do you work all this week,27,7,1,1,0,0,0,0,0,0,0,0,0
spam,1,congratulations ur awarded either of cd gift vouchers free entry our weekly draw txt music to tncs winppmxage,152,25,14,0,1,0,0,0,0,1,0,0,0
ham,0,lol great now im getting hungry,32,6,1,0,0,0,0,0,0,0,0,0,0
ham,0,yes now only saw your message,33,6,1,0,0,0,0,0,0,0,0,0,0
ham,0,ill be at mu in like ltgt seconds,41,8,1,0,0,0,0,0,0,0,0,0,0
ham,0,thing r good thanx got exams in march ive done no revision is fran still with boyf ive gotta interviw exeter bit worriedx,126,24,98,3,0,0,0,0,0,0,0,0,0
ham,0,tell you what if you make a little spreadsheet and track whose idea it was to smoke to determine who smokes too much for the entire month of february ill come up,166,32,2,0,0,0,0,0,0,0,0,0,0
spam,1,for sale arsenal dartboard good condition but no doubles or trebles,71,12,2,1,0,0,0,0,0,0,0,0,0
ham,0,dont look back at the building because you have no coat and i dont want you to get more sick just hurry home and wear a coat to the gym,141,30,2,3,0,0,0,0,0,0,0,0,0
ham,0,my painful personal thought i always try to keep everybody happy all the time but nobody recognises me when i am alone,122,22,3,0,0,0,0,0,0,0,0,0,0
ham,0,thanks for ve lovely wisheds you rock,38,7,2,0,0,0,0,0,0,0,0,0,0
ham,0,you intrepid duo you have a great time and see you both soon,63,13,2,1,0,0,0,0,0,0,0,0,0
ham,0,i asked sen to come chennai and search for job,47,10,1,0,0,0,0,0,0,0,0,0,0
ham,0,dad went out oredi,22,4,1,0,0,0,0,0,0,0,0,0,0
ham,0,i jus hope its true that missin me cos im really missin him you havent done anything to feel guilty about yet,115,22,2,1,0,0,0,0,0,0,0,0,0
ham,0,wat so late still early mah or we juz go dinner lor aiya i dunno,71,16,3,0,0,0,0,0,0,0,0,0,0
ham,0,arms fine hows cardiff and uni,34,6,2,1,0,0,0,0,0,0,0,0,0
ham,0,in fact when do you leave i think addie goes back to school tues or wed,72,16,2,1,0,0,0,0,0,0,0,0,0
ham,0,cool breeze bright sun fresh flower twittering birds all these waiting to wish u goodmorning amp have a nice day,132,21,28,0,0,0,0,0,0,0,0,0,0
ham,0,yagoing for restaurant,26,3,1,0,0,0,0,0,0,0,0,0,0
ham,0,its ok i just askd did u knw tht no,38,10,1,1,0,0,0,0,0,0,0,0,0
spam,1,free st week entry textpod a chance win gb ipod or cash every wk txt pod to tscs custcare,141,26,18,0,1,1,0,0,0,1,0,0,0
ham,0,those ducking chinchillas,25,3,1,0,0,0,0,0,0,0,0,0,0
ham,0,i am in a marriage function,27,6,1,0,0,0,0,0,0,0,0,0,0
ham,0,looks like u wil b getting a headstart im leaving here bout ish but if u r desperate for my company i could head in earlierwe were goin to meet in rummer,159,32,2,0,0,0,0,0,0,0,0,0,0
ham,0,dont give a flying monkeys wot they think and i certainly dont mind any friend of mine and all that,107,20,3,1,0,0,0,0,0,0,0,0,0
spam,1,as a registered optin subscriber ur draw gift voucher will be entered on receipt of a correct ans to whats no in the bbc charts,142,28,7,0,0,0,0,0,0,0,0,0,0
ham,0,say thanks,13,2,0,0,0,0,0,0,0,0,0,0,0
ham,0,msg me when rajini comes,25,5,1,0,0,0,0,0,0,0,0,0,0
ham,0,ya when are taking ure practical lessons i start in june,65,12,3,2,0,0,0,0,0,0,0,0,0
ham,0,thats good because i need drugs,33,6,2,0,0,0,0,0,0,0,0,0,0
ham,0,stupidits not possible,23,3,1,0,0,0,0,0,0,0,0,0,0
ham,0,can all decide faster cos my sis going home liao,53,11,2,0,0,0,0,0,0,0,0,0,0
spam,1,summers finally here fancy a chat or flirt with sexy singles in yr area to get matched up just reply summer now free join optout txt stop help,159,29,25,2,1,0,0,0,0,1,0,0,0
ham,0,u sleeping now or you going to take haha i got spys wat me online checking n replying mails lor,104,20,5,1,0,0,0,0,0,0,0,0,0
spam,1,claire here am havin borin time am now alone u wanna cum over nite chat now hope c u luv claire xx callsminmoremobsemspoboxpowa,154,26,29,1,0,0,0,0,0,0,0,0,0
spam,1,bought one ringtone and now getting texts costing pound offering more tones etc,81,14,1,0,0,0,0,0,0,0,0,0,0
ham,0,yalru lyfu astne chikku bt innu mundhe lyf ali halla ke bilo marriageprogram edhae so lyf is nt yet ovr chikkuali vargu lyfu meow meowd,144,25,3,0,0,0,0,0,0,0,0,0,0
ham,0,kinda first one gets in at twelve aah speak tomo,51,10,4,1,0,0,0,0,0,0,0,0,0
spam,1,urgent your mobile no xxxxxxxxx won a bonus caller prize on this is the nd attempt to reach you call asap,153,25,16,4,0,0,0,1,1,0,0,1,0
