label,label_encoded,cleaned_message,message_length,word_count,capital_count,special_char_count,has_free,has_win,has_winner,has_prize,has_call,has_txt,has_claim,has_urgent,has_guaranteed
ham,0,rose needs water season needs change poet needs imaginationmy phone needs ur sms and i need ur lovely frndship forever,126,20,2,0,0,0,0,0,0,0,0,0,0
ham,0,good afternoon babe how goes that day any job prospects yet i miss you my love sighs,105,22,4,2,0,0,0,0,0,0,0,0,0
ham,0,they will pick up and drop in carso no problem,49,10,1,0,0,0,0,0,0,0,0,0,0
ham,0,si think he is waste for rr,30,7,1,0,0,0,0,0,0,0,0,0,0
ham,0,he is world famamus,23,4,1,0,0,0,0,0,0,0,0,0,0
ham,0,is there coming friday is leave for pongaldo you get any news from your work place,84,16,1,1,0,0,0,0,0,0,0,0,0
ham,0,lol well dont do it without me we could have a big sale together,67,14,2,0,0,0,0,0,0,0,0,0,0
ham,0,am on my way,14,5,1,0,0,0,0,0,0,0,0,0,0
ham,0,eat at old airport road but now oredi got a lot of pple,68,14,3,0,0,0,0,0,0,0,0,0,0
ham,0,sry cant talk on phone with parents,37,7,0,0,0,0,0,0,0,0,0,0,0
ham,0,ok lor wat time finish,26,6,2,1,0,0,0,0,0,0,0,0,0
ham,0,princess i like to make love ltgt times per night hope thats not a problem,84,15,2,1,0,0,0,0,0,0,0,0,0
ham,0,mm i am on the way to railway,29,8,1,0,0,0,0,0,0,0,0,0,0
ham,0,im done im sorry i hope your next space gives you everything you want remember all the furniture is yours if im not around when you move it just lock all the locks and leave the key with jenne,201,39,5,0,0,0,0,0,0,0,0,0,0
ham,0,not yet just id like to keep in touch and it will be the easiest way to do that from barcelona by the way how ru and how is the house,137,31,3,1,0,0,0,0,0,0,0,0,0
spam,1,sppok up ur mob with a halloween collection of nokia logopic message plus a free eerie tone txt card spook to,116,22,15,0,1,0,0,0,0,1,0,0,0
spam,1,urgent call from landline your complementary tenerife holiday or cash await collection sae tcs po box wa px ppm sender hol offer,168,27,20,1,0,0,0,0,1,0,0,1,0
ham,0,kdo it at evening daurgent,33,5,1,0,0,0,0,0,0,0,0,0,0
ham,0,pansy youve been living in a jungle for two years its my driving you should be more worried about,101,19,3,3,0,0,0,0,0,0,0,0,0
ham,0,mm have some kanji dont eat anything heavy ok,45,9,1,0,0,0,0,0,0,0,0,0,0
ham,0,only if you promise your getting out as soon as you can and youll text me in the morning to let me know you made it in ok,124,28,6,0,0,0,0,0,0,0,0,0,0
ham,0,lol thats different i dont go trying to find every real life photo you ever took,84,16,2,0,0,0,0,0,0,0,0,0,0
ham,0,i dont thnk its a wrong calling between us,42,9,1,0,0,0,0,0,0,0,0,0,0
ham,0,k ill drinkpa then what doing i need srs model pls send it to my mail id pa,78,18,2,0,0,0,0,0,0,0,0,0,0
ham,0,aiyah e rain like quite big leh if drizzling i can at least run home,70,15,2,0,0,0,0,0,0,0,0,0,0
ham,0,i have docs appointments next week im tired of them shoving stuff up me ugh why couldnt i have had a normal body,121,24,4,1,0,0,0,0,0,0,0,0,0
ham,0,dun b sad its over dun thk abt it already concentrate on ur other papers k,81,16,4,0,0,0,0,0,0,0,0,0,0
ham,0,greetings me consider yourself excused,42,6,2,1,0,0,0,0,0,0,0,0,0
ham,0,no drama plsi have had enough from you and family while i am struggling in the hot sun in a strange placeno reason why there should be an ego of not going if not invited when actually its necessity to gowait for very serious reppurcussions,245,45,15,0,0,0,0,0,0,0,0,0,0
ham,0,they released another italian one today and it has a cosign option,66,12,1,0,0,0,0,0,0,0,0,0,0
ham,0,you at mu you should try to figure out how much money everyone has for gas and alcohol jay and i are trying to figure out our weed budget,139,29,3,1,0,0,0,0,0,0,0,0,0
spam,1,winner as a valued network customer you hvae been selected to receive a reward to collect call valid hours only aclpm,150,24,15,2,0,0,1,0,1,0,0,0,0
ham,0,hcl chennai requires freshers for voice processexcellent english neededsalary upto ltgt call mssuman ltgt for telephonic interview via indyarockscom,167,19,18,0,0,0,0,0,1,0,0,0,0
ham,0,dai what this da can i send my resume to this id,51,12,2,0,0,0,0,0,0,0,0,0,0
ham,0,i know where the ltgt is ill be there around,55,11,2,0,0,0,0,0,0,0,0,0,0
ham,0,yup ive finished c there,31,6,2,0,0,0,0,0,0,0,0,0,0
ham,0,remember to ask alex about his pizza,36,7,1,0,0,0,0,0,0,0,0,0,0
ham,0,no datoday also i forgot,28,5,1,0,0,0,0,0,0,0,0,0,0
ham,0,ola would get back to you maybe not today but i ve told him you can be his direct link in the us in getting cars he bids for online you arrange shipping and you get a cut or u for a partnership where u invest money for shipping and he takes care of the restuwud b self reliant soon dnt worry,306,62,11,13,0,0,0,0,0,0,0,0,0
ham,0,fwiw the reason im only around when its time to smoke is that because of gas i can only afford to be around when someone tells me to be and that apparently only happens when somebody wants to light up,202,40,3,0,0,0,0,0,0,0,0,0,0
ham,0,hello my boytoy i made it home and my constant thought is of you my love i hope your having a nice visit but i cant wait till you come home to me kiss,160,34,4,1,0,0,0,0,0,0,0,0,0
ham,0,congrats kanowhr s the treat maga,36,6,1,1,0,0,0,0,0,0,0,0,0
ham,0,who u talking about,20,4,1,1,0,0,0,0,0,0,0,0,0
ham,0,yup,6,1,1,0,0,0,0,0,0,0,0,0,0
ham,0,u wake up already wat u doing u picking us up later rite im taking sq reaching ard smth like dat u can check e arrival time c ya soon,150,32,6,3,0,0,0,0,0,0,0,0,0
ham,0,yunny im walking in citylink now faster come down me very hungry,74,13,3,0,0,0,0,0,0,0,0,0,0
ham,0,er yep sure props,19,4,2,1,0,0,0,0,0,0,0,0,0
ham,0,hiya have u been paying money into my account if so thanks got a pleasant surprise when i checked my balance u c i dont get statements that acc,153,31,3,1,0,0,0,0,0,0,0,0,0
spam,1,u have won a nokia plus a free digital camera this is what u get when u win our free auction to take part send nokia to now poboxtcrw,158,32,21,0,1,1,0,0,0,0,0,0,0
ham,0,ok ill send you with in ltdecimalgt ok,45,8,8,0,0,0,0,0,0,0,0,0,0
ham,0,bognor it is should be splendid at this time of year,54,11,2,1,0,0,0,0,0,0,0,0,0
ham,0,yesim in office da,22,4,1,0,0,0,0,0,0,0,0,0,0
ham,0,ok i only ask abt e movie u wan ktv oso,42,11,3,1,0,0,0,0,0,0,0,0,0
ham,0,misplaced your number and was sending texts to your old number wondering why ive not heard from you this year all the best in your mcat got this number from my atlanta friends,179,33,4,0,0,0,0,0,0,0,0,0,0
ham,0,dunno lei i might b eatin wif my frens if wan to eat then i wait lar,82,20,5,0,0,0,0,0,0,0,0,0,0
spam,1,free entry into our weekly comp just send the word win to now tc,100,18,13,0,1,1,0,0,0,0,0,0,0
ham,0,do u noe how send files between computers,46,10,1,1,0,0,0,0,0,0,0,0,0
ham,0,mmmmm i loved waking to your words this morning i miss you too my love i hope your day goes well and you are happy i wait for us to be together again,158,35,6,1,0,0,0,0,0,0,0,0,0
ham,0,jay says hell put in ltgt,32,6,0,0,0,0,0,0,0,0,0,0,0
ham,0,can you just come in for a sec theres somebody here i want you to see,71,16,3,1,0,0,0,0,0,0,0,0,0
ham,0,so the sun is anti sleep medicine,34,7,1,0,0,0,0,0,0,0,0,0,0
ham,0,whats happening with you have you gotten a job and have you begun registration for permanent residency,104,17,2,0,0,0,0,0,0,0,0,0,0
ham,0,yup ok,9,2,1,0,0,0,0,0,0,0,0,0,0
ham,0,glad it went well come over at then well have plenty of time before claire goes to work,95,20,1,0,0,0,0,0,0,0,0,0,0
ham,0,ok enjoy r u there in home,29,8,2,0,0,0,0,0,0,0,0,0,0
ham,0,can you pls pls send me a mail on all you know about relatives coming to deliver here all you know about costs risks benefits and anything else thanks,155,29,3,1,0,0,0,0,0,0,0,0,0
ham,0,you do what all you like,24,6,1,0,0,0,0,0,0,0,0,0,0
ham,0,thats y we haf to combine n c how lor,41,10,1,0,0,0,0,0,0,0,0,0,0
ham,0,the monthly amount is not that terrible and you will not pay anything till months after finishing school,106,18,1,0,0,0,0,0,0,0,0,0,0
ham,0,hmmmhow many players selected,32,4,1,1,0,0,0,0,0,0,0,0,0
ham,0,they said if its gonna snow it will start around or pm tonite they are predicting an inch of accumulation,112,22,2,1,0,0,0,0,0,0,0,0,0
ham,0,i dont can you send it to me plus hows mode,47,11,3,0,0,0,0,0,0,0,0,0,0
ham,0,aiyo please got time meh,28,6,2,0,0,0,0,0,0,0,0,0,0
ham,0,package all your programs well,30,5,1,0,0,0,0,0,0,0,0,0,0
ham,0,she is our sister she belongs our family she is d hope of tomorrow pray herwho was fated d shoranur train incident lets hold our hands together amp fuelled by love amp concern prior her grief amp pain pls join in dis chain amp pass it stop violence against women,289,54,31,0,0,0,0,0,0,0,0,0,0
ham,0,so are you guys asking that i get that slippers again or its gone with last year,80,17,1,0,0,0,0,0,0,0,0,0,0
ham,0,company is very goodenvironment is terrific and food is really nice,70,11,1,0,0,0,0,0,0,0,0,0,0
spam,1,text get more ringtones logos and games from questions,101,11,3,0,0,0,0,0,0,0,0,0,0
ham,0,honestly ive just made a lovely cup of tea and promptly dropped my keys in it and then burnt my fingers getting them out,122,24,1,1,0,0,0,0,0,0,0,0,0
ham,0,yup but not studying surfing lor im in e lazy mode today,59,12,2,0,0,0,0,0,0,0,0,0,0
ham,0,please sen my kind advice please come here and try,58,10,1,0,0,0,0,0,0,0,0,0,0
ham,0,im done c there,21,5,3,0,0,0,0,0,0,0,0,0,0
ham,0,oh fine ill be by tonight,27,6,2,0,0,0,0,0,0,0,0,0,0
ham,0,give me some time to walk there,35,8,1,0,0,0,0,0,0,0,0,0,0
ham,0,ill reach in ard mins ok,31,7,1,0,0,0,0,0,0,0,0,0,0
spam,1,freemsg you have been awarded a free mini digital camera just reply snap to collect your prize quizclub opt out stop pwk sprwm ph,156,24,34,2,1,0,0,1,0,0,0,0,0
ham,0,fuck babe what happened to you how come you never came back,66,14,3,2,0,0,0,0,0,0,0,0,0
spam,1,this message is brought to you by gmw ltd and is not connected to the,70,15,5,0,0,0,0,0,0,0,0,0,0
ham,0,some friends want me to drive em someplace probably take a while,65,12,1,0,0,0,0,0,0,0,0,0,0
ham,0,i also thk too fast xy suggest one not me u dun wan its ok going rain leh where got gd,95,22,4,0,0,0,0,0,0,0,0,0,0
ham,0,are you still getting the goods,32,6,1,0,0,0,0,0,0,0,0,0,0
ham,0,and maybe some pressies,23,4,1,0,0,0,0,0,0,0,0,0,0
ham,0,yeah i am so ill leave maybe ish,36,8,3,1,0,0,0,0,0,0,0,0,0
ham,0,i told her i had a dr appt next week she thinks im gonna die i told her its just a check nothing to be worried about but she didnt listen,144,31,8,0,0,0,0,0,0,0,0,0,0
ham,0,you in your room i need a few,30,8,2,1,0,0,0,0,0,0,0,0,0
ham,0,i dont want to hear anything,28,6,1,0,0,0,0,0,0,0,0,0,0
ham,0,hey for me there is no leave on friday wait i will ask my superior and tell you,83,18,3,0,0,0,0,0,0,0,0,0,0
ham,0,ultimately tor motive tui achieve korli,40,6,1,0,0,0,0,0,0,0,0,0,0
ham,0,from to only my work timing,32,8,1,0,0,0,0,0,0,0,0,0,0
ham,0,and dont worry well have finished by march ish,61,11,0,1,0,0,0,0,0,0,0,0,0
ham,0,the house is on the water with a dock a boat rolled up with a newscaster who dabbles in jazz flute behind the wheel,116,24,1,0,0,0,0,0,0,0,0,0,0
spam,1,congrats mobile g videophones r yours call now videochat wid ur mates play java games dload polyph music noline rentl bx ip we p,160,26,6,1,0,0,0,0,1,0,0,0,0
spam,1,your next amazing xxx picsfree video will be sent to you enjoy if one vid is not enough for day text back the keyword picsfree to get the next video,153,30,18,1,0,0,0,0,0,0,0,0,0
ham,0,now thats going to ruin your thesis,36,7,1,1,0,0,0,0,0,0,0,0,0
ham,0,in sch but neva mind u eat st lor,36,9,1,0,0,0,0,0,0,0,0,0,0
ham,0,hey whats up u sleeping all morning,37,7,2,2,0,0,0,0,0,0,0,0,0
ham,0,erm i thought the contract ran out theth of october,54,10,2,0,0,0,0,0,0,0,0,0,0
ham,0,i dunno until when lets go learn pilates,46,8,2,0,0,0,0,0,0,0,0,0,0
spam,1,u are subscribed to the best mobile content service in the uk for per ten days until you send stop to helpline,134,25,12,0,0,0,0,0,0,0,0,0,0
ham,0,yup im elaborating on the safety aspects and some other issues,65,11,1,0,0,0,0,0,0,0,0,0,0
spam,1,free tarot texts find out about your love life now try for free text chance to only after free msgs each,131,27,36,4,1,0,0,0,0,0,0,0,0
ham,0,goodmorning today i am late for hr,37,7,1,0,0,0,0,0,0,0,0,0,0
ham,0,hi happy birthday hi hi hi hi hi hi hi,39,10,2,0,0,0,0,0,0,0,0,0,0
ham,0,i will be outside office take all from there,44,9,1,0,0,0,0,0,0,0,0,0,0
ham,0,if you dont respond imma assume youre still asleep and imma start calling n shit,82,15,1,0,0,0,0,0,0,0,0,0,0
ham,0,aight see you in a bit,23,6,1,0,0,0,0,0,0,0,0,0,0
ham,0,my superior telling that friday is leave for all other department except oursso it will be leave for youany way call waheed fathima hr and conform it,155,27,1,0,0,0,0,0,1,0,0,0,0
spam,1,join the uks horniest dogging service and u can have sex nite just sign up and follow the instructions txt entry to now,153,25,17,2,0,0,0,0,0,1,0,0,0
ham,0,lol i have to take it member how i said my aunt flow didnt visit for months its cause i developed ovarian cysts bc is the only way to shrink them,153,32,6,1,0,0,0,0,0,0,0,0,0
ham,0,still work going onit is very small house,44,8,1,0,0,0,0,0,0,0,0,0,0
ham,0,my friend just got here and says hes upping his order by a few grams hes got ltgt when can you get here,117,25,1,2,0,0,0,0,0,0,0,0,0
ham,0,tmr timin still da same wat cos i got lesson until,55,12,1,0,0,0,0,0,0,0,0,0,0
ham,0,thats the thing with apes u can fight to the death to keep something but the minute they have it when u let go thats it,126,26,1,1,0,0,0,0,0,0,0,0,0
ham,0,no im not gonna be able to too late notice ill be home in a few weeks anyway what are the plans,109,25,1,0,0,0,0,0,0,0,0,0,0
ham,0,got fujitsu ibm hp toshiba got a lot of model how to say,65,13,2,0,0,0,0,0,0,0,0,0,0
ham,0,okie thanx,16,2,2,0,0,0,0,0,0,0,0,0,0
ham,0,gosh that what a pain spose i better come then,50,11,3,0,0,0,0,0,0,0,0,0,0
ham,0,as usualiam fine happy amp doing well,46,7,1,0,0,0,0,0,0,0,0,0,0
ham,0,okie,4,1,1,0,0,0,0,0,0,0,0,0,0
ham,0,so when you gonna get rimac access,35,7,1,0,0,0,0,0,0,0,0,0,0
ham,0,im at arestaurant eating squid i will be out about wanna dosomething or is that to late,95,18,1,2,0,0,0,0,0,0,0,0,0
ham,0,you call times job today ok umma and ask them to speed up,57,13,1,0,0,0,0,0,1,0,0,0,0
ham,0,hello ucall wen u finish wrki fancy meetin up wiv u all tonite as i need a break from dabooks did hrs last nite today of wrk,132,28,98,1,0,0,0,0,0,0,0,0,0
ham,0,r u sam p in eachother if we meet we can go my house,56,15,39,0,0,0,0,0,0,0,0,0,0
ham,0,yeah lol luckily i didnt have a starring role like you,62,12,2,2,0,0,0,0,0,0,0,0,0
ham,0,hello madam how are you,25,6,1,1,0,0,0,0,0,0,0,0,0
ham,0,awesome text me when youre restocked,38,6,1,0,0,0,0,0,0,0,0,0,0
spam,1,knock knock txt whose there to to enter r weekly draw a gift voucher a store of yr choice tcs age to stoptxtstopweek,156,28,7,0,0,0,0,0,0,1,0,0,0
ham,0,yes its all innocent fun o,32,6,3,0,0,0,0,0,0,0,0,0,0
ham,0,thanks for sending this mental ability question,49,7,1,0,0,0,0,0,0,0,0,0,0
ham,0,sir hope your day is going smoothly i really hoped i wont have to bother you about this i have some bills that i cant settle this month i am out of all extra cash i know this is a challenging time for you also but i have to let you know,243,52,4,0,0,0,0,0,0,0,0,0,0
ham,0,marrow only wed at ltgt to aha,42,8,1,0,0,0,0,0,0,0,0,0,0
ham,0,i went to ur hon lab but no one is there,41,11,1,0,0,0,0,0,0,0,0,0,0
ham,0,hey pple or for nightsexcellent location wif breakfast hamper,81,11,2,5,0,0,0,0,0,0,0,0,0
spam,1,forwarded from hi this is your mailbox messaging sms alert you have matches please call back on to retrieve your messages and matches ccpmin,173,27,9,0,0,0,0,0,1,0,0,0,0
ham,0,how come,9,2,1,1,0,0,0,0,0,0,0,0,0
ham,0,lol nah wasnt too bad thanks its good to b home but its been quite a reality check hows ur day been did u do anything with website,136,28,5,3,0,0,0,0,0,0,0,0,0
ham,0,ok lor,9,2,1,0,0,0,0,0,0,0,0,0,0
ham,0,im coming home dinner,25,5,1,0,0,0,0,0,0,0,0,0,0
ham,0,s daal r above ltgt,27,5,1,0,0,0,0,0,0,0,0,0,0
spam,1,free ring tone just text polys to then every week get a new tone yrs only wk,107,18,19,0,1,0,0,0,0,0,0,0,0
ham,0,unni thank you dear for the rechargerakhesh,45,7,2,0,0,0,0,0,0,0,0,0,0
ham,0,i know im lacking on most of this particular dramastorms details but for the most part im not worried about that,115,21,3,0,0,0,0,0,0,0,0,0,0
ham,0,haha they cant what at the most tmr forfeit haha so how,65,12,3,1,0,0,0,0,0,0,0,0,0
ham,0,hey there glad u r better now i hear u treated urself to a digi cam is it good we r off at pm have a fab new year c u in coupla wks,139,34,5,3,0,0,0,0,0,0,0,0,0
ham,0,no way im going back there,28,6,2,1,0,0,0,0,0,0,0,0,0
spam,1,urgent your mobile no xxx won a bonus caller prize on this is the nd attempt to reach you call asap boxnqp ppm,154,26,30,4,0,0,0,1,1,0,0,1,0
ham,0,i will cal you sir in meeting,30,7,15,0,0,0,0,0,0,0,0,0,0
ham,0,thats what i love to hear v see you sundayish then,53,11,3,0,0,0,0,0,0,0,0,0,0
ham,0,sorry da thangam very very sorry i am held up with prasad,59,12,1,0,0,0,0,0,0,0,0,0,0
ham,0,tiwary to rcbbattle between bang and kochi,44,7,1,0,0,0,0,0,0,0,0,0,0
ham,0,thank god they are in bed,26,6,1,1,0,0,0,0,0,0,0,0,0
ham,0,no i dont have cancer moms making a big deal out of a regular checkup aka pap smear,85,18,3,0,0,0,0,0,0,0,0,0,0
ham,0,am in gobi arts college,23,5,1,0,0,0,0,0,0,0,0,0,0
ham,0,why she wants to talk to me,27,7,1,0,0,0,0,0,0,0,0,0,0
ham,0,pandy joined w technologies todayhe got job,47,7,1,0,0,0,0,0,0,0,0,0,0
spam,1,you are guaranteed the latest nokia phone a gb ipod mp player or a prize txt word collect to no ibhltd ldnwh pmtmsgrcvd,147,25,25,2,0,0,0,1,0,1,0,0,1
ham,0,they can try they can get lost in fact tee hee,49,11,3,1,0,0,0,0,0,0,0,0,0
ham,0,my friends use to call the same,32,7,1,0,0,0,0,0,1,0,0,0,0
ham,0,em its olowoyey uscedu have a great time in argentina not sad about secretary everything is a blessing,107,18,2,0,0,0,0,0,0,0,0,0,0
ham,0,its a taxt massagetiepos argh ok lool,46,7,2,2,0,0,0,0,0,0,0,0,0
ham,0,hi can i please get a ltgt dollar loan from you ill pay you back by mid february pls,96,19,3,0,0,0,0,0,0,0,0,0,0
ham,0,you might want to pull out more just in case and just plan on not spending it if you can i dont have much confidence in derek and taylors money management,157,31,2,0,0,0,0,0,0,0,0,0,0
ham,0,do you like shaking your booty on the dance floor,50,10,1,1,0,0,0,0,0,0,0,0,0
ham,0,text me when you get off dont call my phones having problems,63,12,1,0,0,0,0,0,1,0,0,0,0
ham,0,no need for the drug anymore,29,6,1,0,0,0,0,0,0,0,0,0,0
ham,0,sorry dai was thought of calling you lot of timeslil busyi will call you at noon,87,16,1,0,0,0,0,0,1,0,0,0,0
ham,0,its sarcasm nt scarcasim,27,4,1,0,0,0,0,0,0,0,0,0,0
ham,0,great i have to run now so ttyl,33,8,2,2,0,0,0,0,0,0,0,0,0
ham,0,feel like trying kadeem again v,33,6,2,1,0,0,0,0,0,0,0,0,0
ham,0,dai ltgt naal eruku,27,4,1,0,0,0,0,0,0,0,0,0,0
ham,0,not yet chikkuwat abt u,26,5,1,1,0,0,0,0,0,0,0,0,0
ham,0,want to finally have lunch today,33,6,1,1,0,0,0,0,0,0,0,0,0
ham,0,do you know when dad will be back,34,8,1,1,0,0,0,0,0,0,0,0,0
spam,1,hello darling how are you today i would love to have a chat why dont you tell me what you look like and what you are in to sexy,130,29,2,2,0,0,0,0,0,0,0,0,0
spam,1,free for st week no nokia tone ur mob every week just txt nokia to get txting and tell ur mates pobox w wq norm ptone,165,32,18,1,1,0,0,0,0,1,0,0,0
ham,0,he remains a bro amongst bros,29,6,1,0,0,0,0,0,0,0,0,0,0
ham,0,r u meeting da ge at nite tmr,30,8,1,1,0,0,0,0,0,0,0,0,0
ham,0,was a nice day and impressively i was sensible went home early and now feel fine or am i just boring whens yours i cant remember,140,27,3,2,0,0,0,0,0,0,0,0,0
ham,0,why de you looking good only,34,6,2,0,0,0,0,0,0,0,0,0,0
spam,1,wanna get laid nite want real dogging locations sent direct to ur mobile join the uks largest dogging network txt park to now nyt eca lp msg,163,28,15,3,0,0,0,0,0,1,0,0,0
spam,1,we tried to contact you re your response to our offer of a new nokia fone and camcorder hit reply or call for delivery,130,25,0,0,0,0,0,0,1,0,0,0,0
ham,0,yes they replied my mail im going to the management office later plus will in to bank later alsoor on wednesday,117,21,4,0,0,0,0,0,0,0,0,0,0
ham,0,thats cool ill come by like ltgt ish,45,8,2,0,0,0,0,0,0,0,0,0,0
ham,0,super msg danalla timing,27,4,1,0,0,0,0,0,0,0,0,0,0
ham,0,good afternoon my boytoy how are you feeling today better i hope are you being my good boy are you my obedient slave do you please your queen,153,30,8,5,0,0,0,0,0,0,0,0,0
ham,0,i am ft we will be a good combination,41,10,2,1,0,0,0,0,0,0,0,0,0
ham,0,im sick im needy i want you pouts stomps feet where are you pouts stomps feet i want my slave i want him now,136,30,6,12,0,0,0,0,0,0,0,0,0
ham,0,am on a train back from northampton so im afraid not,56,12,1,1,0,0,0,0,0,0,0,0,0
ham,0,where in abj are you serving are you staying with dad or alone,64,13,2,0,0,0,0,0,0,0,0,0,0
ham,0,was playng doors game and gt racing on phone lol,50,11,1,0,0,0,0,0,0,0,0,0,0
spam,1,new tones this week include mcflyall ab sara jorgeshock will smithswitch to order follow instructions on next message,136,20,14,0,0,0,0,0,0,0,0,0,0
ham,0,im on da bus going home,27,6,1,0,0,0,0,0,0,0,0,0,0
ham,0,i got a call from a landline number i am asked to come to anna nagar i will go in the afternoon,106,27,3,0,0,0,0,0,1,0,0,0,0
ham,0,im okay chasing the dream whats good what are you doing next,66,12,4,0,0,0,0,0,0,0,0,0,0
ham,0,yupz ive oredi booked slots my weekends liao,54,9,2,0,0,0,0,0,0,0,0,0,0
spam,1,urgent we are trying to contact u todays draw shows that you have won a prize guaranteed call from land line claim c valid hrs only,158,28,24,1,0,0,0,1,1,0,1,1,1
ham,0,there r many modelsony ericson also der ltgt it luks good bt i forgot modl no,88,16,1,0,0,0,0,0,0,0,0,0,0
ham,0,yes i know the cheesy songs from frosty the snowman,54,11,2,0,0,0,0,0,0,0,0,0,0
ham,0,ya ok vikky vl c witin ltgt mins and il reply u,56,12,1,0,0,0,0,0,0,0,0,0,0
spam,1,sports fans get the latest sports news str ur mobile wk free plus a free tone txt sport on to norm txtp,153,28,24,0,1,0,0,0,0,1,0,0,0
ham,0,hey tmr meet at bugis,27,7,1,1,0,0,0,0,0,0,0,0,0
spam,1,urgent urgent we have free flights to europe to give away call b th sept take a friend free call now to claim on bannfwflyppm,158,29,24,1,1,0,0,0,1,0,1,1,0
ham,0,all these nice new shirts and the only thing i can wear them to is nudist themed you in mu,95,21,2,1,0,0,0,0,0,0,0,0,0
ham,0,hey sexy buns what of that day no word from you this morning on ym i think of you,95,22,6,2,0,0,0,0,0,0,0,0,0
ham,0,and whenever you and i see we can still hook up too,52,12,1,0,0,0,0,0,0,0,0,0,0
ham,0,nope but im going home now then go pump petrol lor like going rain soon,80,16,2,0,0,0,0,0,0,0,0,0,0
ham,0,can you use foreign stamps for whatever you send them off for,63,12,1,1,0,0,0,0,0,0,0,0,0
spam,1,from lost help,25,5,13,0,0,0,0,0,0,0,0,0,0
ham,0,oh baby of the house how come you dont have any new pictures on facebook,73,15,2,0,0,0,0,0,0,0,0,0,0
ham,0,feb ltgt is i love u day send dis to all ur valued frnds evn me if comes back ull gt married d person u luv if u ignore dis u will lose ur luv evr,165,38,22,1,0,0,0,0,0,0,0,0,0
ham,0,hiya sorry didnt hav signal i havent seen or heard from and neither has which is unusual in itself ill put on the case and get him to sort it out hugs and snogs,169,34,4,2,0,0,0,0,0,0,0,0,0
ham,0,omw back to tampa from west palm you hear what happened,57,11,1,1,0,0,0,0,0,0,0,0,0
ham,0,yup no more already thanx printing n handing it up,56,11,2,0,0,0,0,0,0,0,0,0,0
spam,1,freemsg fancy a flirt reply date now join the uks fastest growing mobile dating service msgs rcvd just p to optout txt stop to reply date now,156,29,16,2,0,0,0,0,0,1,0,0,0
ham,0,what i mean is do they come chase you out when its over or is it stated you can watch as many movies as you want,113,26,1,0,0,0,0,0,0,0,0,0,0
ham,0,s now only i took tablets reaction morning only,50,10,2,0,0,0,0,0,0,0,0,0,0
spam,1,great new offer double mins double txt on best orange tariffs and get latest camera phones free call mobileupd free on now or stoptxt tcs,160,29,35,2,1,0,0,0,1,1,0,0,0
ham,0,nah im a perpetual dd,23,5,4,0,0,0,0,0,0,0,0,0,0
ham,0,sorry de i went to shop,24,6,1,0,0,0,0,0,0,0,0,0,0
spam,1,hope you enjoyed your new content text stop to to unsubscribe helpp provided by tonesyoucouk,118,16,2,0,0,0,0,0,0,0,0,0,0
ham,0,hey you still want to go for yogasana coz if we end at cine then can go bathe and hav the steam bath,101,23,2,1,0,0,0,0,0,0,0,0,0
ham,0,nope im not drivin i neva develop da photos lei,54,10,2,0,0,0,0,0,0,0,0,0,0
ham,0,i am thinking of going down to reg for pract lessons flung my advance haha wat time u going,96,19,3,1,0,0,0,0,0,0,0,0,0
ham,0,cool i am ltgt inches long hope you like them big,59,11,2,1,0,0,0,0,0,0,0,0,0
ham,0,housemaid is the murderer coz the man was murdered on ltgt th january as public holiday all govtinstituitions are closedincluding post officeunderstand,166,22,4,1,0,0,0,0,0,0,0,0,0
ham,0,okie thanx,14,2,2,0,0,0,0,0,0,0,0,0,0
ham,0,go where n buy juz buy when we get there lar,46,11,2,1,0,0,0,0,0,0,0,0,0
ham,0,im working technical support voice process,46,6,1,0,0,0,0,0,0,0,0,0,0
ham,0,its justbeen overa week since we broke up and already our brains are going to mush,84,16,1,1,0,0,0,0,0,0,0,0,0
ham,0,tunde how are you doing this is just wishing you a great day abiola,71,14,3,0,0,0,0,0,0,0,0,0,0
ham,0,nope c then,20,4,3,0,0,0,0,0,0,0,0,0,0
ham,0,no but well do medical missions to nigeria,44,8,2,0,0,0,0,0,0,0,0,0,0
ham,0,no i am not having not any movies in my laptop,46,11,1,0,0,0,0,0,0,0,0,0,0
spam,1,urgent please call from landline cash or a luxury canary islands holiday await collection tcs sae award maq ppm,154,24,14,0,0,0,0,0,1,0,0,1,0
