label,label_encoded,cleaned_message,message_length,word_count,capital_count,special_char_count,has_free,has_win,has_winner,has_prize,has_call,has_txt,has_claim,has_urgent,has_guaranteed
spam,1,private your account statement for shows unredeemed s i m points call identifier code expires,148,21,17,1,0,0,0,0,1,0,0,0,0
ham,0,he needs to stop going to bed and make with the fucking dealing,63,13,1,0,0,0,0,0,0,0,0,0,0
ham,0,how are you my love are you with your brother time to talk english with him grins say hey muhommad penny says hello from across the sea,147,31,8,3,0,0,0,0,0,0,0,0,0
spam,1,we tried to call you re your reply to our sms for a video mobile mins unlimited text free camcorder reply of call now,135,27,16,0,1,0,0,0,1,0,0,0,0
ham,0,hey doc pls i want to get nice t shirt for my hubby nice fiting ones my budget is ltgt k help pls i will load d card abi hwkeep me posted luv mj,154,35,3,0,0,0,0,0,0,0,0,0,0
ham,0,i remain unconvinced that this isnt an elaborate test of my willpower,70,12,1,0,0,0,0,0,0,0,0,0,0
ham,0,life is nothing wen v get everything but life is everything wen v miss something real value of people wil be realized only in their absence gud mrng,157,29,3,0,0,0,0,0,0,0,0,0,0
ham,0,how are you i miss you,24,6,1,2,0,0,0,0,0,0,0,0,0
ham,0,i aint answerin no phone at what is actually a pretty reasonable hour but im sleepy,85,16,2,0,0,0,0,0,0,0,0,0,0
ham,0,hey is rite u put evey mnth is that all,49,13,2,1,0,0,0,0,0,0,0,0,0
ham,0,i am going to bed now prin,26,7,0,0,0,0,0,0,0,0,0,0,0
ham,0,i think just yourself thanks and see you tomo,48,9,2,0,0,0,0,0,0,0,0,0,0
ham,0,if u dun drive then how i go sch,35,10,1,0,0,0,0,0,0,0,0,0,0
ham,0,i not at home now lei,24,6,1,0,0,0,0,0,0,0,0,0,0
spam,1,gsoh good with spam the ladiesu could b a male gigolo join the uks fastest growing mens club reply oncall mjzgroup stop reply stop,167,26,21,3,0,0,0,0,0,0,0,0,0
ham,0,do u hav any frnd by name ashwini in ur college,48,11,1,1,0,0,0,0,0,0,0,0,0
ham,0,jus finish my lunch on my way home lor i tot u dun wan stay in sch today,80,19,2,0,0,0,0,0,0,0,0,0,0
ham,0,k then marrow are you coming to class,39,8,1,0,0,0,0,0,0,0,0,0,0
spam,1,hot live fantasies call now just p per min ntt ltd po box croydon cr wb is a national rate call,122,24,29,0,0,0,0,0,1,0,0,0,0
ham,0,pls send me your address sir,29,6,1,0,0,0,0,0,0,0,0,0,0
ham,0,i want to lick your pussy now,32,7,1,0,0,0,0,0,0,0,0,0,0
ham,0,yo you gonna still be in stock tomorrowtoday im trying to get a dubsack,75,14,2,1,0,0,0,0,0,0,0,0,0
spam,1,urgent your mobile number has been awarded a ukp prize guaranteed call from landline claim valid hrs only ppm,141,21,24,1,0,0,0,1,1,0,1,1,1
ham,0,ill see but prolly yeah,25,5,1,0,0,0,0,0,0,0,0,0,0
ham,0,thought we could go out for dinner ill treat you seem ok,60,12,3,2,0,0,0,0,0,0,0,0,0
ham,0,where are you what do you do how can you stand to be away from me doesnt your heart ache without me dont you wonder of me dont you crave me,154,37,6,6,0,0,0,0,0,0,0,0,0
ham,0,sorry you never hear unless you book it one was kinda a jokethet were really looking for skinny white girls the other was one lineyou can only do so much on camera with that something like that theyre casting on the look,230,42,5,0,0,0,0,0,0,0,0,0,0
ham,0,sure thing big man i have hockey elections at shouldnt go on longer than an hour though,94,18,1,0,0,0,0,0,0,0,0,0,0
ham,0,watch lor i saw a few swatch one i thk quite ok ard but i need nd opinion leh,87,20,3,0,0,0,0,0,0,0,0,0,0
ham,0,hiya do u like the hlday pics looked horrible in them so took mo out hows the camp amrca thing speak soon serena,116,23,5,2,0,0,0,0,0,0,0,0,0
ham,0,babe how goes that day what are you up to i miss you already my love loving kiss i hope everything goes well,126,28,6,3,0,0,0,0,0,0,0,0,0
ham,0,yunny im goin to be late,28,6,2,0,0,0,0,0,0,0,0,0,0
ham,0,doc prescribed me morphine cause the other pain meds arent enough waiting for my mom to bring it that med should kick in fast so im gonna try to be on later,160,32,4,0,0,0,0,0,0,0,0,0,0
ham,0,cool want me to go to kappa or should i meet you outside mu,60,14,2,0,0,0,0,0,0,0,0,0,0
ham,0,hey sexy buns have i told you i adore you loverboy i hope you remember to thank your sister in law for those meatballs grins i love you babe,153,32,5,2,0,0,0,0,0,0,0,0,0
ham,0,may b approve panalambut it should have more posts,55,9,1,0,0,0,0,0,0,0,0,0,0
spam,1,spjanuary male sale hot gay chat now cheaper call national rate from pmin cheap to pmin peak to stop texts call pmin,157,24,9,2,0,0,0,0,1,0,0,0,0
ham,0,me im not workin once i get job,36,8,2,0,0,0,0,0,0,0,0,0,0
ham,0,and by when youre done i mean now,34,8,2,0,0,0,0,0,0,0,0,0,0
ham,0,its ur luck to love someone its ur fortune to love the one who loves u but its a miracle to love a person who cant love anyone except u gud nyt,153,32,13,0,0,0,0,0,0,0,0,0,0
ham,0,hi baby ive just got back from work and i was wanting to see u allday i hope i didnt piss u off on the phone today if u are up give me a call xxx,147,36,3,1,0,0,0,0,1,0,0,0,0
spam,1,freemsg todays the day if you are ready im horny live in your town i love sex fun games netcollex ltd p per msg reply stop to end,152,30,8,2,0,0,0,0,0,0,0,0,0
ham,0,is it your yahoo boys that bring in the perf or legal,55,12,2,1,0,0,0,0,0,0,0,0,0
ham,0,no need to say anything to me i know i am an outsider,54,13,2,0,0,0,0,0,0,0,0,0,0
ham,0,have you ever had one foot before,34,7,0,1,0,0,0,0,0,0,0,0,0
ham,0,just got to ltgt,22,4,1,0,0,0,0,0,0,0,0,0,0
ham,0,good no dont need any receiptswell done yes please tell whats her number i could ring her,111,19,4,2,0,0,0,0,0,0,0,0,0
ham,0,leave it wif me lar wan to carry meh so heavy is da num familiar to,89,19,4,1,0,0,0,0,0,0,0,0,0
ham,0,beautiful truth expression of the face could be seen by everyone but the depression of heart could be understood only by the loved ones gud ni,153,27,9,0,0,0,0,0,0,0,0,0,0
ham,0,infact happy new year how are you where are you when are we seeing,67,14,2,0,0,0,0,0,0,0,0,0,0
spam,1,in the simpsons movie released in july name the band that died at the start of the film agreen day bblue day cred day send a b or c,146,30,18,1,0,0,0,0,0,0,0,0,0
ham,0,thats a shame maybe cld meet for few hrs tomo,48,10,2,2,0,0,0,0,0,0,0,0,0
ham,0,lol i would but despite these cramps i like being a girl,57,12,3,0,0,0,0,0,0,0,0,0,0
ham,0,i cant wait for cornwall hope tonight isnt too bad as well but its rock night shite anyway im going for a kip now have a good night speak to you soon,161,32,8,0,0,0,0,0,0,0,0,0,0
ham,0,pls help me tell sura that im expecting a battery from hont and that if should pls send me a message about how to download movies thanks,139,27,3,0,0,0,0,0,0,0,0,0,0
spam,1,please call amanda with regard to renewing or upgrading your current tmobile handset free of charge offer ends today tel subject to ts and cs,160,28,8,0,1,0,0,0,1,0,0,0,0
ham,0,havent found a way to get another app for your phone eh will you go to the net cafe did you take that job geeee i need you babe i crave to see you,158,37,6,3,0,0,0,0,0,0,0,0,0
ham,0,i only work from mon to thurs but sat i cant leh booked liao which other day u free,90,19,4,1,1,0,0,0,0,0,0,0,0
ham,0,comin to fetch us oredi,29,6,1,0,0,0,0,0,0,0,0,0,0
ham,0,whats nannys address,22,3,1,1,0,0,0,0,0,0,0,0,0
ham,0,haf u eaten wat time u wan me come,38,10,2,2,0,0,0,0,0,0,0,0,0
spam,1,want a new video phone anytime any network mins half price line rental free text for months reply or call for free delivery,144,26,5,3,1,0,0,0,1,0,0,0,0
ham,0,yo call me when you get the chance a friend of mine wanted me to ask you about a big order,92,21,1,0,0,0,0,0,1,0,0,0,0
ham,0,this single single answers are we fighting plus i said am broke and you didnt reply,84,16,2,1,0,0,0,0,0,0,0,0,0
ham,0,it certainly puts things into perspective when something like this happens,74,11,1,0,0,0,0,0,0,0,0,0,0
ham,0,now got tv watch meh u no work today,40,10,2,2,0,0,0,0,0,0,0,0,0
ham,0,i felt sonot any conveying reason ese he what about me,63,11,2,1,0,0,0,0,0,0,0,0,0
ham,0,hows it going got any exciting karaoke type activities planned im debating whether to play football this eve feeling lazy though,134,21,4,2,0,0,0,0,0,0,0,0,0
ham,0,i told that am coming on wednesday,35,7,1,0,0,0,0,0,0,0,0,0,0
ham,0,its ok called mom instead have fun,35,7,1,0,0,0,0,0,0,0,0,0,0
spam,1,dear voucher holder to claim this weeks offer at your pc please go to tscs apply,112,17,8,0,0,0,0,0,0,0,1,0,0
ham,0,well if im that desperate ill just call armand again,54,10,3,0,0,0,0,0,1,0,0,0,0
ham,0,are you at work right now,27,7,1,1,0,0,0,0,0,0,0,0,0
ham,0,havent heard anything and hes not answering my texts so im guessing he flaked that said the jb is fantastic,111,20,3,0,0,0,0,0,0,0,0,0,0
ham,0,mmmmmm i love youso much ahmad i cant wait for this year to begin as every second takes me closer to being at your side happy new year my love,157,32,7,2,0,0,0,0,0,0,0,0,0
ham,0,pls whats the full name of jokes school cos fees in university of florida seem to actually be ltgt k pls holla back,124,23,2,0,0,0,0,0,0,0,0,0,0
ham,0,ok but they said ive got wisdom teeth hidden inside n mayb need remove,77,15,2,0,0,0,0,0,0,0,0,0,0
ham,0,and pls pls drink plenty plenty water,37,7,1,0,0,0,0,0,0,0,0,0,0
ham,0,how are you doing hows the queen are you going for the royal wedding,71,14,3,0,0,0,0,0,0,0,0,0,0
ham,0,hes in lag thats just the sad part but we keep in touch thanks to skype,74,16,2,0,0,0,0,0,0,0,0,0,0
ham,0,ok lor then we go tog lor,28,7,1,0,0,0,0,0,0,0,0,0,0
ham,0,two teams waiting for some players,34,6,1,0,0,0,0,0,0,0,0,0,0
ham,0,can send me a copy of da report,35,9,2,1,0,0,0,0,0,0,0,0,0
ham,0,swhrt how u deyhope ur ok tot about u daylove n misstake care,67,13,0,0,0,0,0,0,0,0,0,0,0
ham,0,ok da i already planned i wil pick you,41,9,2,0,0,0,0,0,0,0,0,0,0
spam,1,urgent please call your abta complimentary spanish holiday or cash await collection sae tcs box po ez ppm,144,23,22,1,0,0,0,0,1,0,0,1,0
ham,0,i just really need shit before tomorrow and i know you wont be awake before like,83,17,2,0,0,0,0,0,0,0,0,0,0
ham,0,im good have you registered to vote,38,7,2,1,0,0,0,0,0,0,0,0,0
ham,0,hmm ok ill stay for like an hour cos my eye is really sore,61,14,1,1,0,0,0,0,0,0,0,0,0
ham,0,dear got bus directly to calicut,32,6,1,0,0,0,0,0,0,0,0,0,0
ham,0,mm umma ask vava also to come tell him can play later together,62,13,1,0,0,0,0,0,0,0,0,0,0
ham,0,well the general price is ltgt oz let me know ifwhenhow much you want,79,14,1,0,0,0,0,0,0,0,0,0,0
ham,0,each moment in a dayhas its own valuemorning brings hopeafternoon brings faithevening brings luvnight brings restwish u find them all todaygood morning,158,22,8,0,0,0,0,0,0,0,0,0,0
ham,0,ltgt w jetton ave if you forgot,37,7,0,0,0,0,0,0,0,0,0,0,0
ham,0,ok im coming home now,23,5,1,0,0,0,0,0,0,0,0,0,0
ham,0,can not use foreign stamps in this country,43,8,1,0,0,0,0,0,0,0,0,0,0
ham,0,sorry its a lot of friendofafriend stuff im just now about to talk to the actual guy who wants to buy,108,21,2,0,0,0,0,0,0,0,0,0,0
spam,1,cmon babe make me horny turn me on txt me your fantasy now babe im hot sticky and need you now all replies cost cancel send stop,148,30,8,1,0,0,0,0,0,1,0,0,0
ham,0,wylie update my weed dealer carlos went to freedom and had a class with lunsford,81,15,1,0,0,0,0,0,0,0,0,0,0
ham,0,are you happy baby are you alright did you take that job i hope your fine i send you a kiss to make you smile from across the sea kiss kiss,154,35,5,3,0,0,0,0,0,0,0,0,0
ham,0,c movie is juz last minute decision mah juz watch lar but i tot not interested,85,18,3,0,0,0,0,0,0,0,0,0,0
ham,0,how are you enjoying this semester take care brother,54,9,2,1,0,0,0,0,0,0,0,0,0
spam,1,important information orange user xxxxxx today is ur lucky day find out why log onto theres a fantastic prizeawaiting you,157,22,102,2,0,0,0,0,0,0,0,0,0
ham,0,get the door im here,22,5,2,0,0,0,0,0,0,0,0,0,0
ham,0,lets use it next week princess,34,7,1,0,0,0,0,0,0,0,0,0,0
ham,0,or i go home first lar wait me lor i put down my stuff first,69,17,3,0,0,0,0,0,0,0,0,0,0
ham,0,i want kfc its tuesday only buy meals only no gravy only mark,74,17,10,1,0,0,0,0,0,0,0,0,0
ham,0,no dahe is stupid daalways sending like thisdon believe any of those messagepandy is a mental,102,16,1,0,0,0,0,0,0,0,0,0,0
ham,0,oi when you gonna ring,22,5,1,0,0,0,0,0,0,0,0,0,0
spam,1,missed call alert these numbers called but left no message,72,11,2,0,0,0,0,0,1,0,0,0,0
ham,0,i attended but nothing is there,32,6,1,0,0,0,0,0,0,0,0,0,0
ham,0,ard like dat lor we juz meet in mrt station then dun haf to come out,77,18,3,0,0,0,0,0,0,0,0,0,0
ham,0,no dear i was sleeping p,26,6,2,0,0,0,0,0,0,0,0,0,0
ham,0,er mw im filled tuth is aight,29,7,1,0,0,0,0,0,0,0,0,0,0
ham,0,will be office around pm now i am going hospital,52,11,2,0,0,0,0,0,0,0,0,0,0
ham,0,actually im waiting for weeks when they start putting ad,60,11,1,0,0,0,0,0,0,0,0,0,0
ham,0,anything lor if they all go then i go lor,44,10,1,0,0,0,0,0,0,0,0,0,0
ham,0,u free on sat rite u wan watch infernal affairs wif me n darren n mayb xy,77,18,2,2,1,0,0,0,0,0,0,0,0
ham,0,yo you around a friend of mines lookin to pick up later tonight,65,13,2,1,0,0,0,0,0,0,0,0,0
ham,0,stupid auto correct on my phone,31,6,1,0,0,0,0,0,0,0,0,0,0
ham,0,double eviction this week spiral and michael and good riddance to them,73,13,3,1,0,0,0,0,0,0,0,0,0
ham,0,the world suffers a lot not because of the violence of bad people but because of the silence of good people gud night,127,23,4,1,0,0,0,0,0,0,0,0,0
ham,0,ok thats cool its just off either raglan rd or edward rd behind the cricket ground gimme ring when ur closeby see you tuesday,131,25,4,0,0,0,0,0,0,0,0,0,0
ham,0,buy one egg for me daplease,31,6,1,0,0,0,0,0,0,0,0,0,0
ham,0,have you started in skye,24,5,1,0,0,0,0,0,0,0,0,0,0
ham,0,have you bookedthe hut and also your time off how are you by the way,71,15,3,3,0,0,0,0,0,0,0,0,0
ham,0,and several to you sir,23,5,1,0,0,0,0,0,0,0,0,0,0
ham,0,u really pig leh sleep so much my dad wake me up at smth eat lunch today,79,19,2,0,0,0,0,0,0,0,0,0,0
ham,0,my love i hope your not doing anything drastic dont you dare sell your pc or your phone,97,20,3,0,0,0,0,0,0,0,0,0,0
spam,1,freemsg our records indicate you may be entitled to pounds for the accident you had to claim for free reply with yes to this msg to opt out text stop,157,31,18,0,1,0,0,0,0,0,1,0,0
ham,0,life style garments account no please,38,6,1,0,0,0,0,0,0,0,0,0,0
ham,0,lol wtf random btw is that your lunch break,44,9,2,0,0,0,0,0,0,0,0,0,0
ham,0,sez hows u de arab boy hope u r all good give my love evry love ya eshxxxxxxxxxxx,88,20,2,1,0,0,0,0,0,0,0,0,0
ham,0,the lay man just to let you know you are missed and thought off do have a great day and if you can send me bimbo and ugos numbers ill appreciate safe,155,32,11,1,0,0,0,0,0,0,0,0,0
ham,0,detroit the home of snow enjoy it,36,7,3,0,0,0,0,0,0,0,0,0,0
spam,1,show ur colours euro offer get an england flag lions tone on ur phone click on the following service message for info,135,25,8,4,0,0,0,0,0,0,0,0,0
ham,0,aight im chillin in a friends room so text me when youre on the way,71,15,2,0,0,0,0,0,0,0,0,0,0
ham,0,is toshiba portege m gd,27,5,1,1,0,0,0,0,0,0,0,0,0
ham,0,well welp is sort of a semiobscure internet thing,49,9,1,0,0,0,0,0,0,0,0,0,0
spam,1,text pass to to collect your polyphonic ringtones normal gprs charges apply only enjoy your tones,105,17,7,0,0,0,0,0,0,0,0,0,0
spam,1,accordingly i repeat just text the word ok on your mobile phone and send,74,14,1,0,0,0,0,0,0,0,0,0,0
ham,0,loosu go to hospital de dont let it careless,46,9,2,0,0,0,0,0,0,0,0,0,0
ham,0,how much for an eighth,23,5,1,1,0,0,0,0,0,0,0,0,0
ham,0,omg joanna is freaking me out shes looked thru all my friends to find photos of me and then shes asking about stuff on my myspace which i havent even logged on in like a year,183,37,7,0,0,0,0,0,0,0,0,0,0
ham,0,send ur birthdate with month and year i will tel u ur life partners name and the method of calculation reply must,118,22,15,0,0,0,0,0,0,0,0,0,0
ham,0,juz now havent woke up so a bit blur blur can dad went out liao i cant cum now oso,92,20,4,1,0,0,0,0,0,0,0,0,0
ham,0,how about clothes jewelry and trips,38,6,1,1,0,0,0,0,0,0,0,0,0
spam,1,block breaker now comes in deluxe format with new features and great graphics from tmobile buy for just by replying get bbdeluxe and take the challenge,157,27,17,0,0,0,0,0,0,0,0,0,0
ham,0,aah a cuddle would be lush id need lots of tea and soup before any kind of fumbling,87,18,3,3,0,0,0,0,0,0,0,0,0
spam,1,important information orange user today is your lucky dayfind out why log onto theres a fantastic surprise awaiting you,152,22,35,2,0,0,0,0,0,0,0,0,0
ham,0,are you plans with your family set in stone,45,10,1,1,0,0,0,0,0,0,0,0,0
ham,0,pls dont forget to study,24,5,1,0,0,0,0,0,0,0,0,0,0
ham,0,youll never believe this but i have actually got off at taunton wow,69,13,2,0,0,0,0,0,0,0,0,0,0
ham,0,den only weekdays got special price haiz cant eat liao cut nails oso muz wait until i finish drivin wat lunch still muz eat wat,141,25,4,0,0,0,0,0,0,0,0,0,0
ham,0,she just broke down a list of reasons why nobodys in town and i cant tell if shes being sarcastic or just faggy,114,23,2,0,0,0,0,0,0,0,0,0,0
ham,0,ltdecimalgt m but its not a common car here so its better to buy from china or asia or if i find it less expensive ill holla,132,27,9,0,0,0,0,0,0,0,0,0,0
ham,0,the greatest test of courage on earth is to bear defeat without losing heartgn tc,85,15,1,0,0,0,0,0,0,0,0,0,0
ham,0,sorry im stil fucked after last nite went tobed at got up work at,75,17,52,0,0,0,0,0,0,0,0,0,0
ham,0,hey so whats the plan this sat,32,7,1,1,0,0,0,0,0,0,0,0,0
ham,0,beauty sleep can help ur pimples too,37,7,1,0,0,0,0,0,0,0,0,0,0
ham,0,great hope you are using your connections from mode men also cos you can never know why old friends can lead you to today,122,24,2,0,0,0,0,0,0,0,0,0,0
spam,1,natalja f is inviting you to be her friend reply yes or no see her stop send stop frnd to,136,22,25,1,0,0,0,0,0,0,0,0,0
ham,0,where to get those,19,4,1,1,0,0,0,0,0,0,0,0,0
ham,0,kind of just missed train cos of asthma attack nxt one in half hr so driving in not sure where to park,106,22,2,0,0,0,0,0,0,0,0,0,0
ham,0,ball is moving a lotwill spin in last so very difficult to bat,67,13,1,0,0,0,0,0,0,0,0,0,0
ham,0,haiyoh maybe your hamster was jealous of million,51,8,2,0,0,0,0,0,0,0,0,0,0
ham,0,can you please send me my auntys number,40,8,1,0,0,0,0,0,0,0,0,0,0
ham,0,im glad you are following your dreams,40,7,2,0,0,0,0,0,0,0,0,0,0
ham,0,ive reached home finally,28,4,1,0,0,0,0,0,0,0,0,0,0
spam,1,urgent important information for user today is your lucky day find out why log onto there is a fantastic surprise awaiting you,163,27,8,2,0,0,0,0,0,0,0,1,0
ham,0,wn u r hurt by d prsn who s close u do fight wit dem coz somtimes dis fight saves a relation bt being quiet leaves nothin in a relation gud eveb,152,33,4,0,0,0,0,0,0,0,0,0,0
ham,0,u can call now,17,4,1,0,0,0,0,0,1,0,0,0,0
ham,0,science tells that chocolate will melt under the sunlight please dont walk under the sunlight bcozi dont want to loss a sweet friend,138,23,5,0,0,0,0,0,0,0,0,0,0
ham,0,yes i come to nyc for audiitions and am trying to relocate,60,12,2,0,0,0,0,0,0,0,0,0,0
ham,0,i pocked you up there before,28,6,1,0,0,0,0,0,0,0,0,0,0
ham,0,congrats thats great i wanted to tell you not to tell me your score cos it might make me relax but its motivating me so thanks for sharing,142,28,4,0,0,0,0,0,0,0,0,0,0
ham,0,i wud never mind if u dont miss me or if u dont need me but u wil really hurt me wen u need me amp u dont tell me take care,139,32,3,0,0,0,0,0,0,0,0,0,0
ham,0,hey mr whats the name of that bill brison book the one about language and words,80,16,1,0,0,0,0,0,0,0,0,0,0
ham,0,okay good no problem and thanx,34,6,1,1,0,0,0,0,0,0,0,0,0
ham,0,for you information ikea is spelled with all caps that is not yelling when you thought i had left you you were sitting on the bed among the mess when i came in i said we were going after you got home from class please dont try and bullshit me it makes me want to listen to you less,290,59,7,0,0,0,0,0,0,0,0,0,0
ham,0,call me when ure done,25,5,1,0,0,0,0,0,1,0,0,0,0
ham,0,gwr,5,1,3,0,0,0,0,0,0,0,0,0,0
ham,0,you best watch what you say cause i get drunk as a motherfucker,63,13,2,0,0,0,0,0,0,0,0,0,0
spam,1,kit strip you have been billed p netcollex ltd po box ig oja,74,15,12,0,0,0,0,0,0,0,0,0,0
spam,1,please call immediately as there is an urgent message waiting for you,81,13,5,0,0,0,0,0,1,0,0,1,0
spam,1,thesmszonecom lets you send free anonymous and masked messagesim sending this message from theredo you see the potential for abuse,138,20,0,3,1,0,0,0,0,0,0,0,0
ham,0,erm woodland avenue somewhere do you get the parish magazine his telephone number will be in there,104,17,3,0,0,0,0,0,0,0,0,0,0
ham,0,are there ta jobs available let me know please cos i really need to start working,82,16,4,1,0,0,0,0,0,0,0,0,0
ham,0,aiyar hard type u later free then tell me then i call n scold n tell u,74,18,2,0,1,0,0,0,1,0,0,0,0
ham,0,yup im free,15,3,1,0,1,0,0,0,0,0,0,0,0
ham,0,good good billy mates all gone just been jogging again did enjoy concert,77,13,3,2,0,0,0,0,0,0,0,0,0
ham,0,yo come over carlos will be here soon,37,8,1,0,0,0,0,0,0,0,0,0,0
ham,0,awww dat is sweet we can think of something to do he he have a nice time tonight ill probably txt u later cos im lonely xxx,129,28,3,2,0,0,0,0,0,1,0,0,0
ham,0,i guess it is useless calling u something important,54,10,1,0,0,0,0,0,0,0,0,0,0
ham,0,ha ha had popped down to the loo when you helloed me hello,63,14,2,1,0,0,0,0,0,0,0,0,0
ham,0,he dint tell anything he is angry on me that why you told to abi,66,15,2,0,0,0,0,0,0,0,0,0,0
ham,0,it so happens that there r waxsto do wat you want she can come and ill get her medical insurance and shell be able to deliver and have basic care im currently shopping for the right medical insurance for her so just give me til friday morning thats when ill see the major person that can guide me to the right insurance,329,62,6,0,0,0,0,0,0,0,0,0,0
ham,0,i keep ten rs in my shelf buy two egg,40,10,1,0,0,0,0,0,0,0,0,0,0
ham,0,i wasnt well babe i have swollen glands at my throat what did you end up doing,86,19,2,1,0,0,0,0,0,0,0,0,0
ham,0,is ur changes da report big cos ive already made changes da previous report,82,16,2,1,0,0,0,0,0,0,0,0,0
ham,0,captain is in our room,24,5,1,0,0,0,0,0,0,0,0,0,0
ham,0,i cant speak bcaz mobile have problem i can listen you but you cannt listen my voice so i calls you later,111,22,3,0,0,0,0,0,0,0,0,0,0
ham,0,hiya stu wot u up im in so much truble at home at moment evone hates me even u wot the hell av i done now y wont u just tell me text bck please luv dan,156,37,115,2,0,0,0,0,0,0,0,0,0
ham,0,si will take mokka players only,36,6,1,0,0,0,0,0,0,0,0,0,0
ham,0,are you still playing with gautham,35,6,1,1,0,0,0,0,0,0,0,0,0
ham,0,hey mr and i are going to the sea view and having a couple of gays i mean games give me a bell when ya finish,112,26,4,1,0,0,0,0,0,0,0,0,0
ham,0,k jason says hes gonna be around so ill be up there around ltgt,72,14,2,0,0,0,0,0,0,0,0,0,0
ham,0,sorry i will be able to get to you see you in the morning,61,15,3,0,0,0,0,0,0,0,0,0,0
ham,0,aight well keep me informed,27,5,1,0,0,0,0,0,0,0,0,0,0
ham,0,am only searching for good dual sim mobile pa,46,9,1,0,0,0,0,0,0,0,0,0,0
ham,0,that seems unnecessarily hostile,32,4,1,0,0,0,0,0,0,0,0,0,0
ham,0,dude got a haircut now its breezy up there,43,9,2,0,0,0,0,0,0,0,0,0,0
spam,1,congrats mobile g videophones r yours call now videochat wid ur mates play java games dload polyh music noline rentl bx ip we pm,161,26,6,2,0,0,0,0,1,0,0,0,0
ham,0,appledayno doctor tulsi leafdayno cancer lemondayno fat cup milkdayno bone problms litres watrdayno diseases snd ths whom u care,154,21,27,0,0,0,0,0,0,0,0,0,0
ham,0,i thought we were doing a king of the hill thing there,55,12,0,0,0,0,0,0,0,0,0,0,0
ham,0,nope ill come online now,27,5,1,0,0,0,0,0,0,0,0,0,0
ham,0,also tell him i said happy birthday,35,7,29,0,0,0,0,0,0,0,0,0,0
ham,0,y bishan lei i tot say lavender,39,8,3,1,0,0,0,0,0,0,0,0,0
ham,0,boo what time u get out u were supposed to take me shopping today,70,15,2,1,0,0,0,0,0,0,0,0,0
ham,0,now u sound like manky scouse boy stevelike i is travelling on da bus homewot has u inmind recreation dis eve,115,22,2,2,0,0,0,0,0,0,0,0,0
ham,0,fyi im taking a quick shower be at epsilon in like ltgt min,68,13,2,0,0,0,0,0,0,0,0,0,0
ham,0,on a tuesday night r u real,29,8,1,0,0,0,0,0,0,0,0,0,0
ham,0,yes when is the appt again,27,6,1,1,0,0,0,0,0,0,0,0,0
ham,0,just got outta class gonna go gym,34,7,1,0,0,0,0,0,0,0,0,0,0
ham,0,i want to sent ltgt mesages today thats y sorry if i hurts,66,13,3,0,0,0,0,0,0,0,0,0,0
ham,0,all write or wat,21,5,1,0,0,0,0,0,0,0,0,0,0
ham,0,ha i wouldnt say that i just didnt read anything into way u seemed i dont like be judgementali save that for fridays in the pub,139,27,4,2,0,0,0,0,0,0,0,0,0
ham,0,its a valentine game send dis msg to all ur friends if answers r d same then someone really loves u ques which colour suits me the best,150,33,3,1,0,0,0,0,0,0,0,0,0
ham,0,hidid you asked to waheeda fathima about leave,49,8,1,1,0,0,0,0,0,0,0,0,0
ham,0,enjoy urself tmr,19,3,1,0,0,0,0,0,0,0,0,0,0
ham,0,you still around i could use a halfth,40,8,2,1,0,0,0,0,0,0,0,0,0
ham,0,you give us back my id proof and ltgt rs we wont allow you to work we will come to your home within days,113,24,3,0,0,0,0,0,0,0,0,0,0
ham,0,bot notes oredi cos i juz rem i got,44,10,2,0,0,0,0,0,0,0,0,0,0
ham,0,yes rent is very expensive so its the way we save,51,11,2,0,0,0,0,0,0,0,0,0,0
ham,0,hows the pain deary r u smiling,33,7,1,2,0,0,0,0,0,0,0,0,0
ham,0,fun fact although you would think armand would eventually build up a tolerance or some shit considering how much he smokes he gets fucked up in like hits,157,29,1,0,0,0,0,0,0,0,0,0,0
spam,1,important information orange user xxxxxxx today is your lucky dayfind out why log onto theres a fantastic surprise awaiting you,163,22,35,2,0,0,0,0,0,0,0,0,0
